id,title
1,Higher Interest Rates Fuel Losses at the Federal Reserve
2,"Fed Signals Smaller Increases, but Ultimately Higher Rates"
3,Why Talk of a Fed 'Pivot' Can Be Confusing
4,Stocks Slip With Focus on Fed
5,How High Will Interest Rates Go?
6,Opinion: Jerome Powell’s Not for Turning—Yet
7,What Fed Officials Said Before Their November Meeting
8,Cash-Rich Consumers Could Mean Higher Interest Rates for Longer
9,Why Did the Stock Rally Fizzle?
10,What Economists and Analysts Are Saying Ahead of Fed's Rate Decision
11,Treasury Yields Fall After Fed Rate Hike
12,Opinion: Why a 2023 Recession May Be Mild
13,The Fed’s Problem With the Job Market
14,Easing Bets Fall Apart as Powell Speaks
15,How High Will Interest Rates Go?
16,Fed’s Pace of Future Interest-Rate Rises in Focus at Meeting
17,Bond Yields Rebound on Powell Hawkishness
18,"No New Projections, But Are the Old Ones Still Relevant?"
19,"Selling in Stocks, Bonds Accelerates"
20,Today's Coverage
21,A Return to Inflation
22,Fed-Funds Futures Show Split Wagers on December Hike
23,"Selling in Stocks, Bonds Accelerates"
24,Today's Coverage
25,"Labor Demand Rose in September, a Setback for the Fed"
26,Stocks Fall After Fed’s Interest-Rate Decision
27,Bond Yields Steady Ahead of Fed Decision
28,"Fed Can Afford to Slow Pace of Rate Increases, Says Capital Economics"
29,What Traders Are Hearing in Powell Speech
30,Traders Expect Higher Interest Rates to Stay
31,Fed Faces Questions Over Pace and Destination of Rate Rises
32,The Key Sentence in the Fed's Statement That's Driving Markets Higher
33,Fed Meeting to Focus on Interest Rates’ Coming Path
34,U.S. Stocks Sell Off After Fed Raises Interest Rates 0.75%
35,Stocks Fall Ahead of Fed Decision
36,U.S. Wages Rose Rapidly in Third Quarter
37,Treasury Yields Fall as Odds of Less Hawkish Fed Increase
38,Atlanta Fed Forecasts Growth Rebound
39,Fed Meeting to Focus on Interest Rates’ Coming Path
40,Stocks Close Sharply Lower After Fed Meeting Ends
41,Stocks Move Lower Ahead of Fed Rate Decision
42,What Traders Are Hearing in Powell Speech
43,Powell Says Window for Economy to Achieve ‘Soft Landing’ Has Narrowed
44,UPS Stock Rises as Earnings Give Investors a Reprieve
45,The Heard on the Street Recap: From Hawk to Dove and Back
46,Traders Expect Higher Interest Rates to Stay
47,Fed Rate Slowdown Talk Offers Respite for Markets
48,Inflation Expectations Rise as Investors Consider Fed Pivot
49,Why Mortgage Rates Are So Darn High
50,The Dow Just Notched Its Best Month Since 1976. But That Previous Rally Quickly Fizzled
51,U.S. Stocks Decline Ahead of Fed Interest-Rate Announcement
52,"Stocks Rise, Yields Fall as Investors Await Fed Decision"
53,Powell: Strong Dollar Is Challenge for Some Countries
54,Powell Says 'Premature' to Discuss Hike Pause
55,Powell Emphasizes There’s ‘A Ways to Go’ on Rates
56,Watch: Fed Raises Interest Rates by 0.75 Point
57,Stocks Rise Amid Earnings Stampede
58,"FOMC Opens Door to Less Dramatic Action in Future, Says First Citizens Bank"
59,ECB Raises Interest Rates by 0.75 Point
60,Stocks Fall on Tuesday Ahead of Fed Meeting
61,Early Earnings Reports Worry Investors Already Battered by Stock Selloff
62,"What the Fed’s Rate Increases Mean for Your Debts, Savings and Financial Plans"
63,Opinion: Rolling Stone Gathers No Facts
64,Voters Get Key Inflation Reading Ahead of Midterms
65,Treasury to Hold Debt Auction Sizes Steady as Fed Cuts Back on Holdings
66,"Yield-Curve Inversion, Classic Recession Warning, Deepens Again"
67,Rising Shipping Costs Prompt Businesses to Get Creative
68,Dollar Rally Fades as Monetary Tightening Expectations Cool
69,"Fed Set to Raise Rates by 0.75 Point, Debate Size of Hikes"
70,UPS Earnings Rise as Higher Prices Offset Shipping Slowdown
71,Rocky Treasury-Market Trading Rattles Wall Street
72,Higher Interest Rates Can Take a Long Time to Bring Down Inflation
73,Opinion: The Feds Don’t Want You Betting on Elections
74,What Fed Rate Hike Means for Your Financial Plans
75,Powell Still Sees Overheated Labor Market
76,3 Reasons to Refinance Student Loans Now
77,Powell Still Sees Overheated Labor Market
78,Charts: How Markets Are Reacting to the Fed Decision
79,"To Solve Inflation, First Solve Deficits, This Theory Advises"
80,Stocks Down at Midday Ahead of Fed
81,Gold Prices Fall
82,Stocks Fall to Session Lows
83,Federal Officials Trade Stock in Companies Their Agencies Oversee
84,Market Loses Steam on Powell Comments
85,Stocks Finished Lower Tuesday
86,Another Rate Hike: What Does It Mean For Your Personal Finances?
87,How to Survive the Next Market Crash
88,Powell's Stern Message Means More Bad News for Tech Trade
89,The Heard on the Street Recap: Pending Larry
90,"International Discord Undercuts Global Growth, Worsens Inflation"
91,Transcript: Fed Chief Powell’s Postmeeting Press Conference
92,What Rate Hikes Mean For Your Wallet
93,Early Earnings Reports Worry Investors Battered by Stock Selloff
94,Gold in a Post-Pandemic Landscape
95,Where Are Markets Headed? Six Pros Take Their Best Guess
96,Bank of Canada Expected to Largely Match Fed on Rate Increases
97,"Businesses Expect Economy to Weaken, Fed’s Beige Book Says"
98,Two-Year Treasury Yields Fall Amid Hopes Fed Will Slow Interest-Rate Increases in December
99,Today's Developments
100,What’s News: Business & Finance
101,This Powerful BlackRock Team Has the Ear of Governments and Megabanks
102,Fed Set to Raise Rates by 0.75 Point and Debate Size of Future Hikes
103,What CEOs Are Saying: The Fed ‘Should Look Out the Front Windshield’
104,Opinion: Too Late for Democrats to Pivot on the Economy
105,"Stocks Close Higher Friday, Cap Off Weekly Gains"
106,Opinion: CFPB Funding Is Ruled Unconstitutional
107,Stock Futures Edge Higher Ahead of Fed’s Rate Decision
108,Opinion: You Can’t Blame High Prices on the Labor Market
109,"Stock Futures, Global Indexes Rise Ahead of Fed Decision"
110,Treasury Yields Rebound After Data Shows Increase in Job Openings
111,What’s the Inflation Rate? It’s a Surprisingly Hard Question to Answer
112,"For Financial Services, the Time Is Always Now"
113,"Stocks Slip After Fed Minutes, Inflation Data"
114,Gold Suffers Worst Losing Streak Since ... 1869 —Deutsche Bank
115,Biden Says GDP Numbers Counter 'Doomsayers'
116,Janet Yellen’s Learning Curve
117,The Bond Market’s Most Powerful Recession Indicator Is (Finally) Flashing Red
118,Health-Insurance Inflation Is Poised to Drop Sharply
119,Dow Jumps More Than 800 Points as Investors Weigh Earnings
120,Federal Authorities Break Up Multimillion-Dollar Catalytic Converter Theft Ring
121,What’s News: Business & Finance
122,Only the Fed Can Return Gold’s Lost Luster
123,Stocks Open Tuesday Mixed With Earnings in Focus
124,Today's Developments
125,The Fungus That Fed Gods And Felled a Pope
126,China’s Xi Jinping Claims Third Term as Communist Party Leader
127,Economy Week Ahead: U.S. GDP and Wages; Monetary Policy Abroad
128,Dan Snyder Hires BofA to Explore Potential Sale of the Washington Commanders
129,"For Financial Services, the Time Is Always Now"
130,"Dow Rises, Nasdaq Falls Ahead of More Tech Earnings"
131,Cooperation Faltering Among Economies
132,Stocks Close Lower With Inflation in Focus
133,Aflac CFO Taps Japanese Debt Investors to Bring Down Interest Costs
134,Today's Developments
135,"Bond Woes Keep Mounting, Spreading Pain to Stocks"
136,"As Covid Hit, Washington Officials Traded Stocks With Exquisite Timing"
137,What’s News: Business & Finance
138,Is the ECB Joining the Central-Bank Slowdown?
139,Stocks Waver in Early Friday Trading
140,Ben Bernanke Among Nobel Economics Prize Winners
141,"U.S. Deficit Shrank Last Fiscal Year, but Is Poised to Widen as Economy Slows"
142,"Economists Now Expect a Recession, Job Losses by Next Year"
143,GDP Bounce Might Soon Fade
144,Can Motown Save U.S. Manufacturing?
145,Microsoft Casts a Very Big Cloud
146,Stocks Close Lower as Yields Notch New Highs
147,Inside the Factory That Feels
148,Bank of Canada to Adopt Meeting-by-Meeting Approach on Interest Rates
149,"Stocks Close Lower as Earnings, Inflation Figures Roll In"
150,U.S. Home Sales Drop for Eighth Straight Month in September
151,High Inflation Darkens Global Economic Outlook
152,Economists Expect U.S. Recession Amid Persistently High Inflation
153,About The Wall Street Journal Economic Forecasting Survey
154,Unaccompanied Afghan Children in U.S. Wait to Be Reunited With Families
155,Elon Musk Sees More Deflation Than Inflation
156,Cooperation May Be Faltering Among World Economies
157,Prologis Signals Caution in Industrial-Property Development
158,Why Housing Can Skew Inflation Numbers
159,Opinion: Welcome to Elon Musk’s Twitter Free Speech Zone
160,Job Openings Rose in September in a Still-Tight Labor Market
161,Bank of Canada Surprises With Half-Point Rise
162,Federal Appeals Court Finds CFPB’s Funding Method Unconstitutional
163,"Apple, Amazon Headline Busy Earnings Week"
164,Opinion: Affirmative Action Mocks Ethnic Diversity
165,The Home-Improvement Boom Isn’t Over Yet
166,"Visa, Mastercard Draw New Government Scrutiny"
167,How Investors Can Prepare for Greater Volatility
168,Topsy-Turvy Markets Are Making It Hard to Cushion Your Portfolio
169,"Visa, Mastercard Draw New Government Scrutiny"
170,New Economic Data Fuel Closing Midterm Campaign Pitches
171,Bank of Canada Gov. Macklem Defends Dial Back in Rate Rises
172,Atlanta Fed President Discloses Violations of Financial Transaction Policies
173,Augusta National Golf Club Under Investigation by DOJ
174,"Turkey, U.N. Push to Revive Ukraine Grain Export Deal After Russia’s Withdrawal"
175,Chinese iPhone City Locks Down to Curb Foxconn Covid Crisis
176,Inflation Data Keeps Fed Focused on Jobs Market
177,Opinion: Kathy Hochul Is No Crime Fighter
178,Top Democrats Push for Focus on Economy Ahead of Midterms
179,Opinion: Are Electric Cars Actually the Future?
180,Central Banks Appear to Be Preparing for Cash Scramble
181,The Teflon Job Market
182,"U.S. Mortgage Rates Top 7%, Highest in More Than 20 Years"
183,Fed Approves U.S. Bancorp Acquisition of MUFG Union Bank
184,Will There Be a Recession? America's Top Bankers Weigh In
185,"Stocks Jump, With Dow Up About 550 Points"
186,China’s Xi Stakes Out Ambitions as Communist Party Gathers
187,Amazon to Use Airbus Cargo Planes for First Time
188,‘Brokered CDs’ Offer Interest Rates Well Above Regular CDs
189,NFT Prosecution Sparks Debate Over Insider-Trading Label
190,"Kidder Peabody CEO Ralph DeNunzio, Surrounded by Giants, Gave Up Firm’s Independence"
191,Economists' Expectations for a Recession Rise Ahead of Election Day
192,Sticky Inflation Solidifies Bets on Another Big Rate Rise by Fed
193,A Building Problem for America’s Housing Market
194,"U.S. Mortgage Rates Top 7%, Highest in More Than 20 Years"
195,‘Brokered CDs’ Offer Interest Rates Well Above Regular CDs
196,Voters Take Stock of Biden's Economic Record
197,Inflation Report Seals Case for 0.75-Point Fed Rate Rise in November
198,"Stocks Jump, With Dow Up About 550 Points"
199,Eurozone Inflation Rate Rises to 10.7% as Recession Looms
200,"From Gap to Zara, Returning Things You Don’t Want Gets Harder"
201,"Political Parties, Voting-Rights Groups Look to Courts as Midterms Near"
202,Traders Shift Rate Bets to Brace for Fed Response
203,"Brazil’s Lula da Silva Wins Election, Beating Bolsonaro"
204,Private Credit’s Time to Shine
205,Whiplash in Markets Shows Investors Are Still on Edge
206,Inflation’s Storm From the Shelter
207,How the Fed Might Slow Down
208,‘Cocoon’ Review: Scars of the Cultural Revolution
209,U.K. Inflation Tops 10% as Policies Cloud Outlook
210,Fed Minutes Show Concerns of More Persistent High Inflation
211,"Bond Yields End Higher After Wild Session, Lifted By Inflation Data"
212,Penguin Random House Blocked From Buying Simon & Schuster
213,Thomas Barrack’s Foreign-Lobbying Trial Goes to Jury
214,Opinion: Inflation and the Midterm Elections
215,Democrats Get More Bad News on Inflation
216,What Fed Officials Are Saying About Inflation and Interest Rates
217,What Investors are Watching in the CPI Report: Core Prices
218,Inside a Jury’s Journey to Convict Trevor Milton
219,Trump Ally Thomas Barrack Testifies at His Own Foreign Lobbying Trial
220,"Bank of Mexico to Drive Interest Rates Higher, Minutes Show"
221,Economy Week Ahead: U.S. Housing Market and Inflation Abroad in Focus
222,Inflation Report Seals Case for 0.75-Point Fed Rate Rise in November
223,Iran’s Response to Protests Draws EU Sanctions Targeting Authorities
224,"Data Centers Face Higher Costs, Weaker Demand for Debt That Fueled Sector’s Rise"
225,"JPMorgan Chase Earnings Show Economy Is Resilient, but Dimon’s ‘Hurricane’ Looms"
226,Top Democrats Push for Focus on Economy Ahead of Midterms
227,The CPI Report Was Everything Investors Were Fearing
228,Core Inflation Hits New Four-Decade High
229,Opinion: The U.S.-Saudi Rift Over Oil Prices Is Déjà Vu All Over Again
230,Stocks Move in Lockstep as Fed’s Rate Increases Show No Mercy
231,Recession Fears Hit Risky Mortgage Debt
232,Bank Stocks Rise Before Third-Quarter Earnings
233,Judge Rejects GOP Bid to Block Student-Loan Forgiveness Program
234,Opinion: The Federal Reserve Slams the Brakes and Risks Spinning Out
235,Fed Approves U.S. Bancorp Acquisition of MUFG Union Bank
236,"Opinion: Ben Bernanke Wins a Nobel, in Theory"
237,How the Supreme Court Overturned Roe v. Wade and Abortion Rights
238,"Opinion: In New York Governor’s Race, Lee Zeldin Sneaks Up on Kathy Hochul"
239,Strong Dollar Buoys Small-Cap Stocks
240,Supplier Prices Increased in September
241,Israel Heads to Its Fifth Election in Four Years
242,"Mortgage Giant Rocket Plunges Back to Earth, Hit by Rising Rates"
243,"IMF Cuts 2023 Global Growth Forecast, Citing Inflation, War and China Slowdown"
244,Why Switzerland’s Central Bank Borrowed $9 Billion This Month
245,Freight Operators’ Peak Shipping Season Is Crumbling
246,Bank of England Pushes On With Bond-Sale Plan
247,Opinion: Biden Deceptions and Inflation
248,CPI Data Sends Treasury Yields to New Multiyear Highs
249,Opinion: The Not-So-Invisible Hand: Central Banks
250,Why Baby Formula Is Still in Short Supply
251,Cost of Borrowing Dollars Rises to Highest Since March 2020
252,"Crypto Poses 'Novel Risks' to Banks, Federal Reserve's Michael Barr Says"
253,"Elon Musk Buys Twitter, Firing Its CEO and CFO"
254,French Protests Highlight Pressure on European Leaders From Energy Crisis
255,Former Treasury Secretary Mnuchin Testifies in Defense of Trump Ally
256,"Fed Needs to Keep Rates High, Evans Says"
257,Japan Bond Market Sets Record for No Trades
258,Two Fed Officials Make Case for Caution With Future Interest Rate Raises
259,Stocks Fall After Wild Surge on Wall Street
260,U.S. Stocks Close Lower on Bank Earnings
261,Dow Surges More Than 800 Points in Volatile Trading
262,Cathie Wood Says Fed Rate Increases Raise Risk of Deflation
263,Opinion: Durham’s FBI Indictment
264,Opinion: An Economics Nobel for and by Central Bankers
265,How José Andrés’s World Central Kitchen Went to War
266,Stocks Fall in Volatile Trading
267,"Midterm Report Card on Biden Economy Clouded by OPEC, Fed Moves"
268,Why Baby Formula Is Still in Short Supply
269,"As Bond Investors’ Bets Blow Up, They Might Usher In Era of Higher Rates"
270,Bank of Korea Goes for Another Outsized 50Bp Rate Increase
271,Opinion: The FBI’s Million-Dollar Dossier
272,"No, Bad News Isn’t Good News for Stocks"
273,Fed Minutes Show Concerns of More Persistent High Inflation
274,Fed’s Brainard Says Rate Rises Will Slow Economy Over Time
275,"Economic Strength Weakens Outlook for Stocks, Bonds"
276,"U.S. Faces 'Decisive Decade' With China, Russia"
277,"Russian Retreat in Ukraine Exposes Collaborators, and Finger-Pointing Begins"
278,Fed Minutes Show Concerns of More Persistent High Inflation
279,World’s Emergency-Lending Capacity Is Getting Stretched
280,What’s News: Business & Finance
281,Strong Dollar Means Big Discounts for Americans Traveling Overseas
282,Ben Bernanke Put His Theories Into Practice
283,Will the Midterm Elections Trigger a Stock-Market Rally?
284,"Banks Feast on Higher Rates, for Now"
285,"U.S. Faces 'Decisive Decade' With China, Russia"
286,Fed’s Evans Says Rates Will Need to Remain at Higher Levels
287,The Bank of England’s Dilemma: Easing and Tightening at the Same Time
288,West Condemns Russian Strikes Across Ukraine
289,Investors Aren’t Betting on Post-Midterm Rally
290,Bank Stocks' Next Test: Earnings Season
291,Core Inflation Hits Four-Decade High
292,Why Is the Stock Market Moving Higher?
293,Opinion: Snoozing on Skilled Immigrant Labor
294,A Jittery Stock Market Heads Into Earnings Season
295,"Stock Futures Waver on Interest-Rate Fears, Ukraine Escalation"
296,"Stock Futures Waver on Interest-Rate Fears, Ukraine Escalation"
297,Strong Dollar Means Big Discounts for Americans Traveling Overseas
298,Retirees Catch a Break With the Social Security COLA
299,What’s News: Business & Finance
300,BlackRock Profit Falls 16%
301,What’s News: Business & Finance
302,Nikola Founder Trevor Milton Convicted of Securities Fraud
303,Fed’s Inflation Fight Has Some Economists Fearing an Unnecessarily Deep Downturn
304,"Nine Million Votes, With Candidates Still Debating"
305,Midterm Elections 2022: How Economic Concerns Are Shaping the Vote
306,Fed on Track for Another Large Interest-Rate Hike After Jobs Report
307,"IMF Warns of Growing Global Risks, Says U.K. Turmoil Largely Contained"
308,Stock Funds Down 24.8% in 2022
309,Inflation Expands Beyond Supply-Chain Struggles to Service Sector
310,Treasury Yields Climb
311,"U.S. Stocks Fall on Interest-Rate, China Trade Concerns"
312,The Jobs Market Is Still Too Hot
313,Jobs Market Shows Signs of Cooling But Remains Tight
314,Fed Officials Say Stubborn Inflation Justifies Continued Rate Increases
315,GM Looks to Parlay Battery Work Into New Energy Business
316,What Fed Officials Are Saying About the Labor Market and Monetary Policy
317,"Opinion: Good Jobs Equal Bad Stocks, Alas"
318,Jobs Market Shows Signs of Cooling But Remains Tight
319,Traders Press Bets That 'Fed Pivot' Isn't on the Horizon
320,They’re the Two Biggest Stars in Sports. Nike Let One Get Away.
321,"Unemployment Expected to Fall Further, Support Hawkish Fed"
322,Judge Weighs Biden Administration’s Student-Loan Forgiveness Plan
323,Iran’s Women Brave Extraordinary Risks to Protest
324,September Jobs Report Shows Hot Labor Market Cooled Some
325,Republicans Gain Momentum as November Nears
326,U.K. Reverses Course on Tax Cut Plan
327,Lending Slows as Rates Rise
328,Dollar Rises Amid Fed’s ‘Hawkish Overdrive’
329,Stocks Tumble After Jobs Report; Indexes Stay On Pace for Weekly Gains
330,"Fed Official Says Inflation Is ‘Stubbornly Persistent,’ Justifying Rapid Rate Rises"
331,Stocks Drop Friday After Jobs Data
332,"In 1970s Inflation Fight, Fed Interest-Rate Rises Sparked Market 'Massacre'"
333,Stocks Slide After Jobless Claims Rise
334,John Durham Puts the FBI on Trial
335,Stocks Drop Friday After Jobs Data
336,Terror Attack Defendant Faces Rare Death-Penalty Trial
337,Strong Dollar Pressures U.S. Manufacturing Rebound
338,Want Higher Rates on Your Savings? It’s Best to Shop Around.
339,Fed on Track for Another Large Rate Rise After Jobs Report
340,Fed’s Rate Increases Defy All the Rules
341,Lending Slows as Rates Rise
342,Opinion: The Fed Has to Stay the Course Against Inflation
343,Latin American Currencies Could Weaken as Fed Keeps Tightening
344,Higher Rates Aren't Lifting Bank Stocks
345,Stocks Fall After Two-Day Rally
346,Opinion: You Didn’t Invent That Drug
347,Joe Biden's Response to the OPEC Oil Cut
348,Dollar On Track for Further Gains After U.S. Jobs Report
349,Dollar On Track for Further Gains After U.S. Jobs Report
350,Opinion: You Didn’t Invent That Drug
351,Currency-Hedged ETFs Start to Make a Comeback
352,Bank of Canada’s Macklem Says ‘More to Be Done’ on Taming Inflation
353,Dow Falls 600 Points on Strong Jobs Picture
354,Want Higher Rates on Your Savings? It’s Best to Shop Around.
355,How a New Anti-Woke Bank Stumbled
356,"Fed Official Says Inflation Fight Will Take Time, Despite Signs of Progress"
357,Why Inflation-Protected Bonds Aren’t Keeping Up With Inflation
358,Job Market Gives Fed an Opening
359,Traders Up Bets on Fed Pivot From Last Week
360,September Jobs Report Shows Slower Wage Gains
361,U.S. Federal Officials Trade Stock in Companies Their Agencies Oversee
362,Why Inflation-Protected Bonds Aren’t Keeping Up With Inflation
363,"U.N. Calls on Fed, Other Central Banks to Halt Rate Rises"
364,Why Interest Rates Are Rising Everywhere—Except Your Savings Account
365,Markets Are Stuck in Overreaction Mode
366,Opinion: Biden’s Marijuana Pardon Will Drive Crime Higher
367,The Fed Needs to Rewrite Its Playbook
368,"Inflation Expectations Moderated in January, New York Fed Says"
369,FedEx Shipping Contractor Turmoil Intensifies as Peak Season Nears
370,Derby’s Take: Fed May Seek to Tamp Down Talk of Very Aggressive Rate Rises
371,Former NY Fed Chief: Fed Needs to Hit Markets to Cool Inflation
372,Elizabeth Warren Presses Fed for Information on Trading Controversy
373,Looking for Financial Market Break Points
374,Fed Staff Reported Securities Trades Amid Bank’s 2020 Stimulus Moves
375,Opinion: Is the Inflation Cure Worse Than the Disease?
376,Market Bets on a Fed Interest-Rate Mistake
377,Fed Tees Up March Interest-Rate Increase
378,Inflation Has Sparked Record Credit-Card Debt: How Things Could Get Messy
379,"FedEx Boosts Dividend, Adds Directors in Deal With Activist"
380,"For Fed, Easing Too Soon Risks Repeat of Stop-and-Go 1970s"
381,Some Congressional Democrats Press Dallas Fed to Select Latino Leader
382,Biden Will Nominate Raskin as Top Fed Banking Regulator
383,Fed Minutes Show Urgency for Raising Rates to Tame High Inflation
384,Fed Minutes Point to Possible Rate Increase in March
385,Sizzling Prices Complicate Fed’s Inflation-Fighting Strategy
386,Fed’s Daly Is Prepared to Back Another 0.75 Percentage Point Rate Hike
387,"FedEx Boosts Dividend, Adds Directors in Deal With Activist"
388,"For Fed, Easing Too Soon Risks Repeat of Stop-and-Go 1970s"
389,Some Congressional Democrats Press Dallas Fed to Select Latino Leader
390,Opinion: Why the Fed May Soon Need Treasury Help
391,Biden Will Nominate Raskin as Top Fed Banking Regulator
392,Opinion: The Fed Needs to Put Its Eye on the Money Supply
393,Derby’s Take: A Sense of the Policy Impact of Cuts to the Fed’s Balance Sheet Emerges
394,Sarah Bloom Raskin in Her Own Words
395,Fed Minutes Show Urgency for Raising Rates to Tame High Inflation
396,Fed Sets Trading Restrictions for Top Officials
397,Fed Minutes Point to Possible Rate Increase in March
398,Sizzling Prices Complicate Fed’s Inflation-Fighting Strategy
399,Fed’s Daly Is Prepared to Back Another 0.75 Percentage Point Rate Hike
400,"Central Bank Should Weigh Asset Sales to Curb Inflation, Says Fed Official"
401,"Inflation, Sharp Rise in Interest Rates Pose Financial Risks, Fed Says"
402,Fed Rate-Setting Panel Gets New Members Amid Rate Expectations
403,Fed’s Mester Sees Need for Aggressive Rate Hikes at Next Two Meetings
404,New York Fed Taps Bond-Trading Executive as Markets Group Chief
405,Derby’s Take: FOMC Minutes Warn Federal Reserve Could Swing to Operating Loss Soon
406,"Derby’s Take: Aggressive Rate Increase Path Could Threaten Fed Profits, Report Warns"
407,Fed Officials Signal Additional Rate Rises Warranted
408,Opinion: Inflation Demands Bold Fed Action
409,FedEx Restores Some Freight Services Suspended by Staff Shortages
410,Loretta Mester Says Fed Is On Track for Aggressive Rate Rises
411,Fed’s Quantitative Tightening Throws Wrench Into Mortgage Market
412,Bond Yields Surge Ahead of Fed Meeting
413,Opinion: The Humbling of the Federal Reserve
414,Derby’s Take: 75 Basis Point Rate Rise Bet Didn’t Gain Traction With Fed Officials
415,"Fed Raises Interest Rate by Half Point, Ratcheting Up Its Inflation Fight"
416,May Jobs Report Keeps Fed on Track for Half-Point Interest-Rate Rises
417,Fed Makes Its Largest Rate Hike Since 1994
418,Opinion: The Message of Sarah Raskin’s Defeat
419,Investors Bet Fed Will Need to Cut Rates Next Year
420,New York Fed Model Sees High Probability of Hard Landing for Economy
421,Inflation Fears Drove Larger Fed Rate Increase
422,Investors Look Beyond Expected Fed Rate Rise
423,"Interest Rates Are Well Below What Academic Formulas Suggest, Fed Report Says"
424,Biden Weighs Choice of Jerome Powell or Lael Brainard as Fed Chair
425,Fed Steps Up Talks on Shrinking Balance Sheet
426,Why Wall Street and the Fed Have Been At Odds Lately
427,BofA Sees Fed Likely to Slow Tightening to 50 Basis Points
428,FedEx to Raise Shipping Rates by 6.9% as It Combats Slowdown
429,Bond Market Delivers Mixed Verdict on Fed Rate Forecasts
430,"Fed Raises Interest Rate by Half Point, Ratcheting Up Its Inflation Fight"
431,Powell Pressed Over How Fed Would Respond to Economic Slowdown
432,Derby’s Take: Russia’s War on Ukraine Clouds Outlook for Dissent at Fed Meeting
433,Fed Makes Its Largest Rate Hike Since 1994
434,Deutsche Bank Sees May Announcement on Fed Shrinking Its Balance Sheet
435,Derby’s Take: Inflation Fight Raises Questions About the Fed’s Tool Kit
436,"Gerald Corrigan, Who Led New York Fed During Wall Street Turmoil, Dies"
437,Fed’s John Williams Says Half-Point Rate Rise Is Reasonable Option for May
438,Fedspeak Cheat Sheet: What Fed Officials Said Before Their January Meeting
439,Fed’s Bostic Says More Strong Data Could Tip Fed Toward 75 Basis Point Rate Increase
440,Dallas Fed Names New York Fed Staffer Lorie Logan as President
441,"Interest Rates Are Well Below What Academic Formulas Suggest, Fed Report Says"
442,Loretta Mester Says Fed Is On Track for Aggressive Rate Rises
