id,title
443,Fed’s Quantitative Tightening Throws Wrench Into Mortgage Market
444,"Derby’s Take: As Fed Meeting Looms, Yield Curve Offers Complicated Message"
445,Why Wall Street and the Fed Have Been At Odds Lately
446,New York Fed: Longer Term Inflation Expectations Rose in April
447,Fed Programs Have Kept Finance Flowing to Fossil Fuels
448,Powell Says Economy No Longer Needs Aggressive Stimulus
449,FedEx to Raise Shipping Rates by 6.9% as It Combats Slowdown
450,‘21st Century Monetary Policy’ Review: Rosy Memories of the Fed
451,Powell Pressed Over How Fed Would Respond to Economic Slowdown
452,Derby’s Take: A Hawkish Case for Fed Action on Inflation Emerges
453,Derby’s Take: It’s a Full House When It Comes to Regional Fed Chiefs
454,Opinion: The Risks of Fed Hesitancy on Inflation Are Too Great
455,Fed’s Bostic Says More Strong Data Could Tip Fed Toward 75 Basis Point Rate Increase
456,Opinion: Wish the Fed Luck as It Seeks a Soft Landing on Inflation
457,"Derby’s Take: As Fed Meeting Looms, Yield Curve Offers Complicated Message"
458,Inflation Bets Recede After Powell Speech
459,"Fed Dials Back Bond Purchases, Plots End to Stimulus by June"
460,"High Inflation, Falling Unemployment Prompted Powell’s Fed Pivot"
461,Opinion: Rising Interest Rates Will Crush the Federal Budget
462,Fed’s Bullard Leans Toward 0.75-Percentage-Point September Hike
463,How the Fed Could Lose Its Nerve
464,Opinion: What Happens When the Fed Runs the Show?
465,Derby’s Take: Russia’s War on Ukraine Clouds Outlook for Dissent at Fed Meeting
466,NY Fed Official: New Fed Tools Can’t Eliminate All Bond Turbulence
467,Deutsche Bank Sees May Announcement on Fed Shrinking Its Balance Sheet
468,Derby’s Take: Inflation Fight Raises Questions About the Fed’s Tool Kit
469,"Gerald Corrigan, Who Led New York Fed During Wall Street Turmoil, Dies"
470,Fed’s John Williams Says Half-Point Rate Rise Is Reasonable Option for May
471,Fedspeak Cheat Sheet: What Fed Officials Said Before Their January Meeting
472,Can the Fed Lower Inflation Without Causing a Recession?
473,Biden Nears Endgame on Fed Chair Decision
474,Derby’s Take: Fed Likely to Use Job View in FOMC Statement to Tee Up March Rate Hike
475,"Fed Minutes Flag Value of Liquidity Tools, Sketch Balance Sheet Plans"
476,Derby’s Take: SF Fed Paper Says Yield Curve Doesn’t Signal Big Recession Risk
477,Dallas Fed Names New York Fed Staffer Lorie Logan as President
478,Is the Fed Deflating Prospects for Speculative Stocks?
479,Inflation Bets Recede After Powell Speech
480,The Fed Prepares to Roll Back Pandemic Stimulus
481,Opinion: What Happens When the Fed Runs the Show?
482,Should the U.S. Issue a Digital Dollar?
483,Opinion: Learning to Believe the Fed
484,Derby’s Take: It’s a Full House When It Comes to Regional Fed Chiefs
485,NY Fed: Public’s Near-Term Inflation Expectations Again Hit Record in February
486,Fedspeak Cheat Sheet: What Fed Officials Said Before Their June Meeting
487,Derby’s Take: Fed Balance Sheet Plans Could Impact Huge Reverse Repo Use
488,Fed Wrestles With Challenge of How Fast to Raise Rates
489,Powell Says Fed Will Consider More-Aggressive Interest-Rate Increases to Reduce Inflation
490,Fed’s Barkin Says Rate Increases Can Wait; Global Central Bank Chiefs Talk Inflation
491,Derby’s Take: SF Fed Paper Says Yield Curve Doesn’t Signal Big Recession Risk
492,Fed Nominee Raskin Agrees to Expanded Ethics Pledge to Slow Revolving Door With Wall Street
493,The Fed Has a Tricky Task to Pull Off at Jackson Hole
494,Opinion: Fed Interest Hikes May End Up Having Unintended Consequences
495,"Opinion: The Fed Ignored the Money Supply, and a Recession Is Coming"
496,Opinion: Sarah Raskin’s Systemic Risk at the Federal Reserve
497,Why Wall Street and the Fed Have Been At Odds Lately
498,The Fed Prepares to Roll Back Pandemic Stimulus
499,Opinion: Double-Digit Inflation and Blinkered Fed Policy
500,New Dallas Fed Chief Puts Inflation Fight on Front Burner
501,"Fed Outlook Intact After Powell Testimony, J.P. Morgan Says"
502,"Fed’s Mary Daly Supports Tighter Policy, Doesn’t Expect Recession"
503,"Opinion: Volcker, Powell and the Price of Amnesia About Monetary Policy"
504,Derby’s Take: Powell Says Providing Clear Guidance on Rates Is Likely on Hold
505,Derby’s Take: Inflation Fight Raises Questions About the Fed’s Tool Kit
506,"Gerald Corrigan, Who Led New York Fed During Wall Street Turmoil, Dies"
507,Fed’s John Williams Says Half-Point Rate Rise Is Reasonable Option for May
508,Fedspeak Cheat Sheet: What Fed Officials Said Before Their January Meeting
509,Richmond Fed’s Barkin Says a March Rate Rise Is Conceivable
510,Opinion: Goodbye Fed Forward Guidance? Let Us Hope
511,"Following Fed’s Lead, Banks Shift Forecasts to Big Rate Increases"
512,Federal Reserve’s Portfolio Runoff Has Begun
513,NY Fed: Public’s Near-Term Inflation Expectations Again Hit Record in February
514,Derby’s Take: Fed Balance Sheet Plans Could Impact Huge Reverse Repo Use
515,The Fed's Shifting Inflation Message
516,Derby’s Take: Fed Officials Showing Little Concern About Bond Market Developments
517,Fed Wrestles With Challenge of How Fast to Raise Rates
518,"Fed’s New Trading Rules Will Be Implemented Soon, Powell Says"
519,Opinion: Double-Digit Inflation and Blinkered Fed Policy
520,Opinion: ‘No’ on Fed Chairman Jerome Powell
521,Fed’s Williams Flags ‘Roaring’ Recovery While Acknowledging Inflation Jump
522,"Opinion: Fed Action on Inflation Is Too Little, Too Late"
523,Odds of Steep Fed Rate Move Seen Climbing
524,Fedspeak Cheat Sheet: What Fed Officials Said Before Their May Meeting
525,Should the U.S. Issue a Digital Dollar?
526,"Kansas City Fed Rescinds Master Account for Payments Firm, GOP Senator Says"
527,Derby’s Take: Two Fed Indexes Show Underlying Inflation Picking Up
528,Fed Officials Push Back Against Prospect of Half-Point Increase in March
529,Powell Lays Groundwork for Faster End to Stimulus as Inflation Outlook Worsens
530,The Fed Has a Tricky Task to Pull Off at Jackson Hole
531,Former Fed Staffer: Real Possibility of 50 Basis Point Rate Increase
532,Derby’s Take: SF Fed Paper Says Yield Curve Doesn’t Signal Big Recession Risk
533,Derby’s Take: Fed’s Bullard Says Yield-Curve Signal Might Not Be So Ominous
534,Treasury Yields Drop After CPI Data
535,"Fed Fears Hit Mortgage Bonds, Attracting Investors"
536,New York Fed: Public’s Expectations for Inflation in November 2022 Rise to 6%
537,Jobs Report Likely Keeps Fed on Track for Rate Rise in March
538,Powell Says Fed Must Accept Higher Recession Risk to Combat Inflation
539,Derby’s Take: Former Fed Staffer Not Shrugging Off Central Bank’s Bond Losses
540,Powell Says Fed Acted Quickly to Tighten Stock-Trading Rules
541,Stocks End Higher Amid New Fed Comments
542,"Opinion: Inflation Isn’t Transitory, but It Isn’t Permanent Either"
543,Fed’s Mester Says Economy on Track for a March Rate Rise
544,What Investors Should Make of ‘Powell Pivot’
545,"Opinion: Fed Action on Inflation Is Too Little, Too Late"
546,Derby’s Take: Fed’s Bullard Says Yield-Curve Signal Might Not Be So Ominous
547,Stocks Turn Lower After Fed Announcement on Rates
548,Powell Says Fed Has Resolve to Bring U.S. Inflation Down
549,NY Fed Official Sees Declining Use of Fed Reserve Repo Tool
550,"Kansas City Fed Rescinds Master Account for Payments Firm, GOP Senator Says"
551,FedEx to Suspend Sunday Delivery in Some Markets
552,Fedspeak Cheat Sheet: What Fed Officials Said Before Their September Meeting
553,Raskin Faces Senate Questions Over Climate Views
554,Opinion: Biden Plays Capture the Federal Reserve
555,Fed Officials Push Back Against Prospect of Half-Point Increase in March
556,Derby’s Take: Chicago Fed Chief Says Dot Plot Is Doing Big Work for Policy Outlook
557,Derby’s Take: Two Fed Indexes Show Underlying Inflation Picking Up
558,"China Targeted Fed to Build Informant Network, Probe Says"
559,"Fed Outlook Intact After Powell Testimony, J.P. Morgan Says"
560,Treasury Yields Drop After CPI Data
561,"Fed Fears Hit Mortgage Bonds, Attracting Investors"
562,Wall Street Bets the Fed Is Bluffing in High-Stakes Inflation Game
563,"Fed’s Mary Daly Supports Tighter Policy, Doesn’t Expect Recession"
564,"Opinion: Volcker, Powell and the Price of Amnesia About Monetary Policy"
565,"Kansas City Fed Rescinds Master Account for Payments Firm, GOP Senator Says"
566,Derby’s Take: Powell Says Providing Clear Guidance on Rates Is Likely on Hold
567,Powell Lays Groundwork for Faster End to Stimulus as Inflation Outlook Worsens
568,Fed Officials Push Back Against Prospect of Half-Point Increase in March
569,Shrinking Deficits Cushion Fed’s Retreat From Markets
570,New York Fed: Public’s Expectations for Inflation in November 2022 Rise to 6%
571,Jobs Report Likely Keeps Fed on Track for Rate Rise in March
572,Stocks Rally After Fed Rate Increase
573,NY Fed Survey Finds Jump in Near-Term Inflation Expectations in May
574,Fed Nominations Leave Questions Over Regulation
575,Derby’s Take: Former Fed Staffer Not Shrugging Off Central Bank’s Bond Losses
576,Chicago Fed President Charles Evans to Retire in Early 2023
577,"As Fed Steps Back From Mortgage Bonds, Borrowing Costs Rise; Meet Fed Board Nominee Philip Jefferson"
578,Fed Reports Point to Businesses Expecting Higher Inflation
579,"Amid Churning Markets, Fed Liquidity Tools Show No Signs of Stress"
580,Developing Countries Brace for Impact From Fed Rate Increases
581,6 U.S. Banks Will Assess Their Climate Resilience in Fed Pilot Program
582,Fed Official Leaves Door Open to Larger Rate Increase in March
583,Fed Weighs Proposals for Eventual Reduction in Bond Holdings
584,Inflation Report Keeps Fed On Track for Half-Point May Rate Increase
585,Stocks End Higher Amid New Fed Comments
586,"Lawmakers Question Powell on Inflation, Job Market"
587,Public Health Risk; Inflation Watch; Fed’s Quarles to Step Down
588,Opinion: How the Fed Rigs the Bond Market
589,Derby’s Take: Former Fed Staffer Not Shrugging Off Central Bank’s Bond Losses
590,"Opinion: Inflation Isn’t Transitory, but It Isn’t Permanent Either"
591,"Opinion: Inflation, Money Supply and Spiraling Expectations"
592,Powell Says Fed Acted Quickly to Tighten Stock-Trading Rules
593,What Investors Should Make of ‘Powell Pivot’
594,Fed’s Mester Says Economy on Track for a March Rate Rise
595,Stocks Turn Lower After Fed Announcement on Rates
596,The Fed Still Isn’t the Stock Market’s Friend
597,Raskin Faces Senate Questions Over Climate Views
598,Opinion: An Economist’s Winding Path to an Inflation Reality Check
599,"Opinion: Monetary Policy, Growth and the Supply Side"
600,Fedspeak Cheat Sheet: What Fed Officials Said Before Their March Meeting
601,April Inflation Report Cinches Fed’s Half-Point Rate Rise Path
602,Fed’s Brainard Says Too Soon to Say If Rate-Rise Pace Can Slow
603,"China Targeted Fed to Build Informant Network, Probe Says"
604,Opinion: Biden Plays Capture the Federal Reserve
605,"Fed Outlook Intact After Powell Testimony, J.P. Morgan Says"
606,Derby’s Take: Chicago Fed Chief Says Dot Plot Is Doing Big Work for Policy Outlook
607,"Fed’s Mary Daly Supports Tighter Policy, Doesn’t Expect Recession"
608,J.P. Morgan Sees Likely September Start for Shrinking Fed’s Balance Sheet
609,Ukraine Crisis Could Cause Fed Balance Sheet to Grow
610,"Opinion: Volcker, Powell and the Price of Amnesia About Monetary Policy"
611,Opinion: A Fed Chairman at Treasury
612,Opinion: The Fed Can’t Slay Inflation Alone
613,White House Considers Cordray as Top Fed Banking Regulator
614,Derby’s Take: Powell Says Providing Clear Guidance on Rates Is Likely on Hold
615,‘The Lords of Easy Money’ Review: An Inflated Sense of Ability
616,Fed Nominations Leave Questions Over Regulation
617,Opinion: The Fed Battles Wyoming on Cryptocurrency
618,Fed’s Kashkari Says Central Bank Must Deliver on Monetary-Policy Guidance
619,Fed Raises Interest Rates by 0.75 Percentage Point for Third Straight Meeting
620,Opinion: How the Fed Rigs the Bond Market
621,"Spurred by Inflation, the Fed Raises Rates and Promises More"
622,"Fed Officials See Need for Continued Rate Increases, but Less Certainty Over Destination"
623,Inflation Report Keeps Fed On Track for Half-Point May Rate Increase
624,The Odds Don’t Favor the Fed’s Soft Landing
625,"Fed’s Bullard Is Upbeat on Jobs Data, Presses for Hawkish Monetary Policy"
626,"Opinion: Inflation, Money Supply and Spiraling Expectations"
627,The Fed Still Isn’t the Stock Market’s Friend
628,Two Fed Officials Weigh Prospect of Speeding Bond-Buying Taper Process
629,Treasury Yields Rise After Fed Signals Turn to Tighter Monetary Policy
630,Opinion: What Jerome Powell Can Learn From Arthur Burns
631,Derby’s Take: Economists See Fed Penciling In Two 2022 Rate Increases at FOMC Meeting
632,Opinion: The Fed Aims to Hit an Inflation Target—on Average
633,White House Considers Cordray as Top Fed Banking Regulator
634,The Fed Still Isn’t the Stock Market’s Friend
635,J.P. Morgan Sees Likely September Start for Shrinking Fed’s Balance Sheet
636,Ukraine Crisis Could Cause Fed Balance Sheet to Grow
637,"Spurred by Inflation, the Fed Raises Rates and Promises More"
638,Opinion: An Economist’s Winding Path to an Inflation Reality Check
639,FedEx and FourKites to Share Package-Tracking Data
640,Fed on Path for Another 0.75-Point Interest-Rate Lift After Powell’s Inflation Pledge
641,Fedspeak Cheat Sheet: What Fed Officials Said Before Their March Meeting
642,April Inflation Report Cinches Fed’s Half-Point Rate Rise Path
643,Fed’s Brainard Says Too Soon to Say If Rate-Rise Pace Can Slow
644,New York Fed Survey Finds Long-Term Inflation Expectations Falling
645,Can Central Banks Maintain Their Autonomy?
646,The Jan. 6 Committee Subpoenas Donald Trump
647,Russia-Ukraine War Risks Putting Fed in Bigger Bind
648,Biden Expected to Pick Fed Chief Soon; Fed Officials Flag Limits to Central Bank’s Climate Change Role
649,Markets Brace for Hard Landing as Fed Delivers Sobering Message
650,Fed’s Kashkari Says Central Bank Must Deliver on Monetary-Policy Guidance
651,Opinion: The Fed Battles Wyoming on Cryptocurrency
652,Beware Wishful Thinking About Inflation and Recession
653,Opinion: War in Ukraine Complicates the Fed’s Inflation Strategy
654,Fed Signals Half-Point Rate Increases Could Be Warranted
655,Former Treasury Official Is Front-runner for Fed Banking Regulator
656,Democratic Senators Press Fed to Add Teeth to New Central Bank Ethics Rules
657,Fed’s Policy Shift Ripples Through the Housing Market
658,Fed’s Waller Supports 0.75-Percentage-Point Rate Hike in July
659,"Derby’s Take: Pandemic Stimulus Was Just Right, Powell Says"
660,"Supply Imbalances Continued to Hold Back U.S. Growth This Fall, Fed’s Beige Book Says"
661,"The Inflation Hits Just Keep Coming, Raising Stakes for the Fed"
662,"U.S. Job Openings Fell in August, Layoffs Up Slightly"
663,"Interest-Rate Surge Starts to Ripple Through Economy, From Homes to Car Loans"
664,FedEx and FourKites to Share Package-Tracking Data
665,Two Fed Officials Say It Is Time to Pare Back Stimulus
666,Fed Officials Flag High Inflation and Some Warn of Rate Rises if Pressure Persists
667,"Hot Economy, Rising Inflation: The Fed Has Never Successfully Fixed a Problem Like This"
668,Treasury Yields Reverse Post-Fed Climb
669,Fed’s Powell Affirms Need to Act Strongly on Inflation
670,Geithner Says Fed Pivot Spotlights Need for Treasury Overhaul
671,Russia-Ukraine War Risks Putting Fed in Bigger Bind
672,"Fed’s Top Banking Regulator Signals Tougher Merger Reviews, ‘Living Wills’"
673,Can Central Banks Maintain Their Autonomy?
674,Fed Officials Weigh Future Rate Policy Shift
675,"Fed Officials See Need for Continued Rate Increases, but Less Certainty Over Destination"
676,The Fed Hasn’t Caught Omicron Yet
677,Kashkari Says Fed Needs to Keep Tightening
678,The Odds Don’t Favor the Fed’s Soft Landing
679,Biden Expected to Pick Fed Chief Soon; Fed Officials Flag Limits to Central Bank’s Climate Change Role
680,Kansas City Fed’s George Moves Back in Line With Consensus
681,Fed Eyeing Potential for Faster Rate Increases to Ease Inflation
682,"Renters Losing Hope They Will Be Homeowners, New York Fed Survey Finds"
683,Fed Launches Review of Possible Central Bank Digital Currency
684,Fed’s Evans: Time to Move Toward Tighter Monetary Policy
685,Former Fed Staffer: Standing Repo Facility Suffering From Stigma
686,"Derby’s Take: Amid Inflation Woes, Analysts Think Fed Has Further to Go on Rates"
687,Derby’s Take: Economists See Fed Penciling In Two 2022 Rate Increases at FOMC Meeting
688,James Bullard Says Fed Needs to Front-Load Rate Raises Amid Inflation Surge
689,J.P. Morgan Sees Likely September Start for Shrinking Fed’s Balance Sheet
690,Ukraine Crisis Could Cause Fed Balance Sheet to Grow
691,Opinion: Sarah Bloom Raskin Does Not Belong at the Fed
692,Fed’s Barkin Supported FOMC’s Large Rate Increase
693,Biden Will Tap Powell for New Term as Fed Chairman
694,Inside the Fed’s Powell-Brainard Policy Alliance; Eurozone Inflation Narrative in Spotlight
695,"Spurred by Inflation, the Fed Raises Rates and Promises More"
696,Derby’s Take: Fed Governor Explains Why Volcker Strategy Isn’t Needed Now
697,Fed Seen as Unlikely to Raise Rates by 50 Basis Points Next Month
698,Opinion: Sarah Bloom Raskin’s Revolving Door
699,Think Tank Report Says Fed’s New Rate Path Still Pretty Dovish
700,Derby’s Take: Fed Adds Crypto-Assets to Financial Risk Calculus
701,Big Banks Pass Fed Stress Test
702,"Fed Reverse Repo Use Grinds Higher, Hits Record for Year"
703,Derby’s Take: Some Fed Officials See September as Key Moment for Monetary Policy
704,New York Fed Survey Finds Long-Term Inflation Expectations Falling
705,Markets Brace for Hard Landing as Fed Delivers Sobering Message
706,Fed on Path for Another 0.75-Point Interest-Rate Lift After Powell’s Inflation Pledge
707,"Fed Raises Interest Rates 75 Basis Points, Says More Hikes Likely"
708,Bond Market Sends Ominous Message as Fed Tightens Rate Policy
709,The Fed Is Still Feeling the Inflation Heat
710,Top New York Fed Lawyer to Leave Bank in June
711,Opinion: The Fed Battles Wyoming on Cryptocurrency
712,"Fed Reverse Repo Use Grinds Higher, Hits Record for Year"
713,Markets Brace for Hard Landing as Fed Delivers Sobering Message
714,Derby’s Take: Some Fed Officials See September as Key Moment for Monetary Policy
715,Fed Raises Interest Rates by 0.75 Percentage Point for Third Straight Meeting
716,The Fed Is Still Feeling the Inflation Heat
717,"Two Democrats Oppose Powell for Fed Chair, Citing Climate Change"
718,Top New York Fed Lawyer to Leave Bank in June
719,Two Fed Officials Weigh Prospect of Speeding Bond-Buying Taper Process
720,Powell Says Fed Is on Track to Raise Rates in Two Weeks
721,Fed Preparing to Lift Rates Another 0.75 Percentage Point
722,Senate Confirms Brainard as Federal Reserve’s Vice Chairwoman
723,Derby’s Take: Powell Says Impact of Balance Sheet Drawdown Very Uncertain
724,Powell Says Fed Must Show Resolve in Fighting Inflation
725,"Bullard Says Fed’s Inflation-Fighting Credibility at Risk, New Scrutiny of Fed Vice Chairman’s Trading"
726,Derby’s Take: Recent Papers Question Fed’s Way of Viewing Economy
727,High Inflation Keeps Pressure on Fed to Dial Back Stimulus Faster
728,Stocks' Rise Bucks Trend of Falling After Fed Days
729,New York Fed: Americans See Inflation a Year From Now at 6%
730,Powell Says Fed Must Show Resolve in Fighting Inflation
731,Fed’s Policy Shift Ripples Through the Housing Market
732,New York Fed: Americans See Inflation a Year From Now at 6%
733,Two Fed Officials Weigh Prospect of Speeding Bond-Buying Taper Process
734,Flat Yield Curve Tied to Expectations of Front-Loaded Fed Rate Increases
735,"Derby’s Take: Amid Anxious Markets, Fed Officials Still Don’t See Recession"
736,Stocks Hit Records as Fed Scales Back Bond Buying
737,Stocks Fall Ahead of Fed Decision This Week
738,Top Fed Official Says Continued High Inflation Would Be Problematic
739,"Fed May Sow Pessimism If Rate Increases Not Clearly Explained, Report Says"
740,Opinion: Powell Puts Volcker on Hold
741,"Fed Inspector General Finds Powell, Clarida Didn’t Trade Improperly"
742,Fed Beige Book: Economy Grew at Modest Pace to Close 2021
743,Fed Vice Chairman Clarida to Resign
744,Fed’s Evans: Inflation Is Much Too High and Fed Must Act
745,Markets Have Priced In Fed Winding Down Its Balance Sheet
746,Fed’s Mester Says 50-Basis-Point Rate Rise Is on the Table
747,Derby’s Take: Recent Papers Question Fed’s Way of Viewing Economy
748,High Inflation Keeps Pressure on Fed to Dial Back Stimulus Faster
749,Biden Pledges to Back Fed in Effort to Combat High Inflation
750,Economists Seek Recession Clues in the Yield Curve
751,"Hopes for Fed Pivot Have Faded, Sapping Stocks’ Momentum"
752,"Fed Raises Interest Rates, Signals More Hikes This Year"
753,Fed Likely to Consider 0.75-Percentage-Point Rate Increase
754,Jerome Powell Will Face a Very Different Economy in a Second Term
755,Biden Close to Picking Fed Chief; Fed Views on Inflation Response Differ; Consumers Keep Spending
756,Fed Nominee Barr Supports Rewriting Lending Rules
757,A Crucial Week for the U.S. Economy
758,"Fed’s Patrick Harker Expects Steady, Deliberate Path of Rate Rises"
759,Financial Vulnerabilities Generally Not Linked to Fed Policy
760,Is the Labor Market Overheating?
761,"On Inflation Surge, the Fed Is Running Out of Excuses"
762,Fed Watchers Scrutinize Jackson Hole for Hints on Interest-Rate Outlook
763,"For the Fed, 2021 Was a Year for ‘Recalibrating’"
764,Derby’s Take: Fed Paper Sees Scant Predictive Value in Key Treasury Yield Relationship
765,Bond Yields Fall on Jobs Report
766,NY Fed’s Williams Says Short-Term Rate Regime Working Well
767,Senate Takes Up Brainard’s Nomination for Fed Vice Chair; Mester and Bullard Point to Interest-Rate Increases
768,"For the Fed, 2021 Was a Year for ‘Recalibrating’"
769,Derby’s Take: Fed Paper Sees Scant Predictive Value in Key Treasury Yield Relationship
770,"Fed’s Patrick Harker Expects Steady, Deliberate Path of Rate Rises"
771,Senate Tees Up Votes on Biden’s Fed Nominees
772,Financial Vulnerabilities Generally Not Linked to Fed Policy
773,Is the Labor Market Overheating?
774,"On Inflation Surge, the Fed Is Running Out of Excuses"
775,Fed Watchers Scrutinize Jackson Hole for Hints on Interest-Rate Outlook
776,Biden Pledges to Back Fed in Effort to Combat High Inflation
777,Stocks Fall Ahead of Fed Decision This Week
778,Inflation Report Keeps Fed on Aggressive Rate-Rise Path
779,Fed Nominee Has Pressed to Reverse Trump-Era Banking Policies
780,Biden To Nominate Raskin as Top Fed Banking Regulator
781,Senators Press Fed Chair Jerome Powell on Reforms for Regional Fed Banks
782,"Public Expects Inflation of 5.7% in a Year, New York Fed Survey Shows"
783,Fed’s Williams Says Treasury Market Has Faced Too Many Shocks
784,The Jan. 6 Committee Subpoenas Donald Trump
785,Ex-Fed Official Says Rate of at Least 3.5% Will Be Needed
786,Fed’s July Meeting: What to Watch
787,Opinion: Rescue From Recession Won’t Be So Easy This Time
788,"Fed Raises Interest Rates, Signals More Hikes This Year"
789,Fed Finalizes Guidelines for Access to Its Payment Systems
790,"Economy Week Ahead: Housing, Inflation, the Fed"
791,NY Fed Says Consumers Saw in August Steep Declines in Future Inflation
792,Fed Beige Book Says U.S. Economy Grew Modestly Amid Omicron Surge
793,Fed Nominee Barr Supports Rewriting Lending Rules
794,Bond Yields Inch Higher After Powell Inflation Remarks
795,Upward Revision for Atlanta Fed’s GDPNow
796,"For the Fed, 2021 Was a Year for ‘Recalibrating’"
797,Derby’s Take: Fed Paper Sees Scant Predictive Value in Key Treasury Yield Relationship
798,"U.S. Economy Grows Moderately Amid High Inflation, Ukraine Invasion"
799,Financial Vulnerabilities Generally Not Linked to Fed Policy
800,"Opinion: The Fed Should Target Inflation, Not a Dollar Value"
801,Opinion: The Economic Mess We’re In
802,Senators Press Fed Chair Jerome Powell on Reforms for Regional Fed Banks
803,"Fed Raises Rates by 0.75 Percentage Point, Largest Increase Since 1994"
804,Derby’s Take: Fed Taper Not Taking Wind Out of Treasury Market’s Sails
805,Deutsche Bank: Financial System Flush With Fed Cash Into 2023
806,Opinion: Is the Fed Headed for a Crash Landing?
807,Opinion: Nobody Knows How Interest Rates Affect Inflation
808,"Fed Raises Interest Rates, Signals More Hikes This Year"
809,Flat Yield Curve Tied to Expectations of Front-Loaded Fed Rate Increases
810,"Economy Week Ahead: Housing, Inflation, the Fed"
811,Stocks Hit Records as Fed Scales Back Bond Buying
812,Fed Nominee Barr Supports Rewriting Lending Rules
813,"Opinion: The Fed Should Target Inflation, Not a Dollar Value"
814,"Next Time, the Fed Might Give No Quarter"
815,Fed Beige Book: Economy Grew at Modest Pace to Close 2021
816,Upward Revision for Atlanta Fed’s GDPNow
817,"For the Fed, 2021 Was a Year for ‘Recalibrating’"
818,Derby’s Take: Fed Paper Sees Scant Predictive Value in Key Treasury Yield Relationship
819,"U.S. Economy Grows Moderately Amid High Inflation, Ukraine Invasion"
820,Financial Vulnerabilities Generally Not Linked to Fed Policy
821,"Tech Stocks Sink, Bonds Sell Off as Investors Study Fed Minutes"
822,Opinion: Is the Fed Headed for a Crash Landing?
823,"Brainard, Waller and Evans Weigh In on Fed’s Inflation Fight; White House Reveals Nominations for Fed Board"
824,Derby’s Take: Fed Could Hold Back on Rate Guidance at FOMC Meeting
825,Why the Fed Doesn’t Want You to Get Too Used to High Inflation
826,Fed Officials Lay Out Case for Further Rate Rises
827,Opinion: The Economic Mess We’re In
