id,title
1,Higher Interest Rates Fuel Losses at the Federal Reserve
2,Stocks Slip With Focus on Fed
3,"Fed Signals Smaller Increases, but Ultimately Higher Rates"
4,Why Talk of a Fed 'Pivot' Can Be Confusing
5,How High Will Interest Rates Go?
6,Cash-Rich Consumers Could Mean Higher Interest Rates for Longer
7,Opinion: Jerome Powell’s Not for Turning—Yet
8,Treasury Yields Fall After Fed Rate Hike
9,What Fed Officials Said Before Their November Meeting
10,Opinion: Why a 2023 Recession May Be Mild
11,Why Did the Stock Rally Fizzle?
12,What Economists and Analysts Are Saying Ahead of Fed's Rate Decision
13,The Fed’s Problem With the Job Market
14,Bond Yields Rebound on Powell Hawkishness
15,Easing Bets Fall Apart as Powell Speaks
16,How High Will Interest Rates Go?
17,Fed’s Pace of Future Interest-Rate Rises in Focus at Meeting
18,"No New Projections, But Are the Old Ones Still Relevant?"
19,"Selling in Stocks, Bonds Accelerates"
20,Today's Coverage
21,A Return to Inflation
22,"Labor Demand Rose in September, a Setback for the Fed"
23,"Fed Tries to Thread the Needle, Drawing Blood"
24,Stocks Fall After Fed’s Interest-Rate Decision
25,Bond Yields Steady Ahead of Fed Decision
26,Fed Tells Markets to Focus on Interest-Rate Endpoint
27,"Fed Can Afford to Slow Pace of Rate Increases, Says Capital Economics"
28,Fed Faces Questions Over Pace and Destination of Rate Rises
29,The Key Sentence in the Fed's Statement That's Driving Markets Higher
30,Fed Meeting to Focus on Interest Rates’ Coming Path
31,U.S. Wages Rose Rapidly in Third Quarter
32,Treasury Yields Fall as Odds of Less Hawkish Fed Increase
33,U.S. Stocks Sell Off After Fed Raises Interest Rates 0.75%
34,Stocks Fall Ahead of Fed Decision
35,Atlanta Fed Forecasts Growth Rebound
36,Fed Meeting to Focus on Interest Rates’ Coming Path
37,Fed-Funds Futures Show Split Wagers on December Hike
38,Stocks Close Sharply Lower After Fed Meeting Ends
39,Stocks Move Lower Ahead of Fed Rate Decision
40,The U.S. Economy Grew More than Expected. Traders Don't See That Changing the Fed's Calculus
41,"The State of the Economy, and Markets, Ahead of the Fed"
42,Gold Outlook 2022
43,Stocks Close Sharply Lower After Fed Meeting Ends
44,Stocks Move Lower Ahead of Fed Rate Decision
45,UPS Stock Rises as Earnings Give Investors a Reprieve
46,Inflation Expectations Rise as Investors Consider Fed Pivot
47,The Heard on the Street Recap: From Hawk to Dove and Back
48,Fed Rate Slowdown Talk Offers Respite for Markets
49,Why Mortgage Rates Are So Darn High
50,The Dow Just Notched Its Best Month Since 1976. But That Previous Rally Quickly Fizzled
51,U.S. Stocks Decline Ahead of Fed Interest-Rate Announcement
52,Powell: Strong Dollar Is Challenge for Some Countries
53,Powell Says 'Premature' to Discuss Hike Pause
54,"Stocks Rise, Yields Fall as Investors Await Fed Decision"
55,Powell: Fed Could Begin to Slow Pace of Rate Rises in December
56,Powell Emphasizes There’s ‘A Ways to Go’ on Rates
57,Watch: Fed Raises Interest Rates by 0.75 Point
58,"FOMC Opens Door to Less Dramatic Action in Future, Says First Citizens Bank"
59,Bank of Canada Raises Interest Rate By Smaller-Than-Expected Half Point
60,"Fed Approves Fourth 0.75-Point Rate Rise, Hints at Smaller Hikes"
61,Stocks Rise Amid Earnings Stampede
62,ECB Raises Interest Rates by 0.75 Point
63,Treasury to Hold Debt Auction Sizes Steady as Fed Cuts Back on Holdings
64,Bank of Canada Raises Interest Rate By Smaller-Than-Expected Half Point
65,"Fed Approves Fourth 0.75-Point Rate Rise, Hints at Smaller Hikes"
66,Stocks Fall on Tuesday Ahead of Fed Meeting
67,"Yield-Curve Inversion, Classic Recession Warning, Deepens Again"
68,"Volatility Bets Cool As Fed, Earnings Fears Subside"
69,Early Earnings Reports Worry Investors Already Battered by Stock Selloff
70,Opinion: Rolling Stone Gathers No Facts
71,Voters Get Key Inflation Reading Ahead of Midterms
72,Rising Shipping Costs Prompt Businesses to Get Creative
73,"Fed Set to Raise Rates by 0.75 Point, Debate Size of Hikes"
74,Today's Coverage
75,Dollar Rally Fades as Monetary Tightening Expectations Cool
76,UPS Earnings Rise as Higher Prices Offset Shipping Slowdown
77,Rocky Treasury-Market Trading Rattles Wall Street
78,Higher Interest Rates Can Take a Long Time to Bring Down Inflation
79,Opinion: The Feds Don’t Want You Betting on Elections
80,What Fed Rate Hike Means for Your Financial Plans
81,Powell Still Sees Overheated Labor Market
82,3 Reasons to Refinance Student Loans Now
83,"Stock Market Today, Nov. 2, 2022: Stocks Fall After Fed Hikes Interest Rates 0.75 Percentage Point"
84,Powell Still Sees Overheated Labor Market
85,"To Solve Inflation, First Solve Deficits, This Theory Advises"
86,Traders Pare Bets on Aggressive Fed Tightening
87,Charts: How Markets Are Reacting to the Fed Decision
88,Stocks Down at Midday Ahead of Fed
89,Gold Prices Fall
90,"Under Powell, the S&P 500 Tends to Rise on Fed Days"
91,Federal Officials Trade Stock in Companies Their Agencies Oversee
92,Stocks Fall to Session Lows
93,Market Loses Steam on Powell Comments
94,Another Rate Hike: What Does It Mean For Your Personal Finances?
95,Stocks Finished Lower Tuesday
96,How to Survive the Next Market Crash
97,Powell's Stern Message Means More Bad News for Tech Trade
98,The Heard on the Street Recap: Pending Larry
99,"International Discord Undercuts Global Growth, Worsens Inflation"
100,What Rate Hikes Mean For Your Wallet
101,Transcript: Fed Chief Powell’s Postmeeting Press Conference
102,Early Earnings Reports Worry Investors Battered by Stock Selloff
103,Gold in a Post-Pandemic Landscape
104,Where Are Markets Headed? Six Pros Take Their Best Guess
105,Bank of Canada Expected to Largely Match Fed on Rate Increases
106,"Businesses Expect Economy to Weaken, Fed’s Beige Book Says"
107,Two-Year Treasury Yields Fall Amid Hopes Fed Will Slow Interest-Rate Increases in December
108,Today's Developments
109,What’s the Inflation Rate? It’s a Surprisingly Hard Question to Answer
110,"Businesses Expect Economy to Weaken, Fed’s Beige Book Says"
111,This Powerful BlackRock Team Has the Ear of Governments and Megabanks
112,What’s News: Business & Finance
113,Fed Set to Raise Rates by 0.75 Point and Debate Size of Future Hikes
114,What CEOs Are Saying: The Fed ‘Should Look Out the Front Windshield’
115,"Stock Futures Fall, Dollar Firms as Investors Await Wednesday's Fed Move"
116,"Stocks Close Higher Friday, Cap Off Weekly Gains"
117,What’s News: Business & Finance
118,Opinion: Too Late for Democrats to Pivot on the Economy
119,Opinion: CFPB Funding Is Ruled Unconstitutional
120,Opinion: You Can’t Blame High Prices on the Labor Market
121,Stock Futures Edge Higher Ahead of Fed’s Rate Decision
122,Strong October for Bank Stocks Bucks Negative Trend
123,"Stock Futures, Global Indexes Rise Ahead of Fed Decision"
124,"For Financial Services, the Time Is Always Now"
125,What’s the Inflation Rate? It’s a Surprisingly Hard Question to Answer
126,Janet Yellen’s Learning Curve
127,Gold Suffers Worst Losing Streak Since ... 1869 —Deutsche Bank
128,Biden Says GDP Numbers Counter 'Doomsayers'
129,The Bond Market’s Most Powerful Recession Indicator Is (Finally) Flashing Red
130,What’s News: Business & Finance
131,Dow Jumps More Than 800 Points as Investors Weigh Earnings
132,Health-Insurance Inflation Is Poised to Drop Sharply
133,Only the Fed Can Return Gold’s Lost Luster
134,What’s News: Business & Finance
135,Federal Authorities Break Up Multimillion-Dollar Catalytic Converter Theft Ring
136,The Fungus That Fed Gods And Felled a Pope
137,Today's Developments
138,"Third-Party Candidate Drops Out of Arizona Senate Race, Endorses Blake Masters"
139,Treasury Yields Surge to New Post-2008 Crisis Highs
140,Dan Snyder Hires BofA to Explore Potential Sale of the Washington Commanders
141,Stocks Rise to Highest Levels in Over a Month
142,China’s Xi Jinping Claims Third Term as Communist Party Leader
143,Stocks Open Tuesday Mixed With Earnings in Focus
144,Economy Week Ahead: U.S. GDP and Wages; Monetary Policy Abroad
145,"For Financial Services, the Time Is Always Now"
146,China’s Xi Jinping Claims Third Term as Communist Party Leader
147,Economy Week Ahead: U.S. GDP and Wages; Monetary Policy Abroad
148,Stocks Close Lower With Inflation in Focus
149,Today's Developments
150,Janet Yellen’s Learning Curve
151,"As Covid Hit, Washington Officials Traded Stocks With Exquisite Timing"
152,Cooperation Faltering Among Economies
153,Investors are Fleeing Emerging Markets. Some Strategists Say It's Time to Buy
154,"Bond Woes Keep Mounting, Spreading Pain to Stocks"
155,Aflac CFO Taps Japanese Debt Investors to Bring Down Interest Costs
156,What’s News: Business & Finance
157,Stocks Waver in Early Friday Trading
158,Ben Bernanke Among Nobel Economics Prize Winners
159,"U.S. Deficit Shrank Last Fiscal Year, but Is Poised to Widen as Economy Slows"
160,Is the ECB Joining the Central-Bank Slowdown?
161,"Economists Now Expect a Recession, Job Losses by Next Year"
162,Can Motown Save U.S. Manufacturing?
163,Today's Developments
164,Stocks Close Lower as Yields Notch New Highs
165,Microsoft Casts a Very Big Cloud
166,Inside the Factory That Feels
167,Microsoft Casts a Very Big Cloud
168,"Stocks Close Lower as Earnings, Inflation Figures Roll In"
169,Bank of Canada to Adopt Meeting-by-Meeting Approach on Interest Rates
170,About The Wall Street Journal Economic Forecasting Survey
171,U.S. Home Sales Drop for Eighth Straight Month in September
172,High Inflation Darkens Global Economic Outlook
173,Economists Expect U.S. Recession Amid Persistently High Inflation
174,Elon Musk Sees More Deflation Than Inflation
175,Opinion: Welcome to Elon Musk’s Twitter Free Speech Zone
176,Why Housing Can Skew Inflation Numbers
177,Prologis Signals Caution in Industrial-Property Development
178,Unaccompanied Afghan Children in U.S. Wait to Be Reunited With Families
179,Cooperation May Be Faltering Among World Economies
180,Bank of Canada Surprises With Half-Point Rise
181,Opinion: Affirmative Action Mocks Ethnic Diversity
182,Federal Appeals Court Finds CFPB’s Funding Method Unconstitutional
183,Job Openings Rose in September in a Still-Tight Labor Market
184,"Apple, Amazon Headline Busy Earnings Week"
185,"Visa, Mastercard Draw New Government Scrutiny"
186,Bank of Canada Likely Teeing Up Another 0.75-Point Rate Rise
187,How Investors Can Prepare for Greater Volatility
