id,title
828,Senators Press Fed Chair Jerome Powell on Reforms for Regional Fed Banks
829,"Rate Increase Expectations Wane Post Fed, Post GDP"
830,Powell: Fed Is on Track to Raise Rates in March
831,Fed’s Mester Says More Rate Rises are Needed Amid Inflation Surge
832,Biden To Nominate Raskin as Top Fed Banking Regulator
833,Fed's Bullard: Four Interest Rate Rises in 2022 Now Appear Likely
834,Senate Confirms Powell to Second Term Leading Fed
835,Opinion: Rescue From Recession Won’t Be So Easy This Time
836,Fed’s Williams Sees Another Large Rate Rise in July as Possible
837,Jobs Report to Keep Fed on Aggressive Tightening Path
838,Stocks Fall After FedEx Warning
839,Quarles Says Fed Will Need to Raise Rates to Cool Inflation
840,"FedEx Warning, Economic Worries Drag U.S. Stocks Lower"
841,Stocks Slide as Investors Assess Fed Comments
842,Fed’s Balance Sheet Drawdown Could Be Bumpy
843,Fed’s Waller Explains Move to Favor Less Aggressive Rate Hike
844,Derby’s Take: Cleveland Fed Finds Some Data Understate Inflation Trend
845,Fed Officials Offer Clues on Rate Outlook in First Appearances Since Policy Meeting
846,Financial Vulnerabilities Generally Not Linked to Fed Policy
847,"Tech Stocks Sink, Bonds Sell Off as Investors Study Fed Minutes"
848,Opinion: Is the Fed Headed for a Crash Landing?
849,"Brainard, Waller and Evans Weigh In on Fed’s Inflation Fight; White House Reveals Nominations for Fed Board"
850,Derby’s Take: Fed Could Hold Back on Rate Guidance at FOMC Meeting
851,Why the Fed Doesn’t Want You to Get Too Used to High Inflation
852,Fed Officials Lay Out Case for Further Rate Rises
853,Opinion: The Economic Mess We’re In
854,"Rate Increase Expectations Wane Post Fed, Post GDP"
855,Jerome Powell’s Dilemma: What if the Drivers of Inflation Are Here to Stay?
856,Fed’s Mester Says More Rate Rises are Needed Amid Inflation Surge
857,Biden To Nominate Raskin as Top Fed Banking Regulator
858,February Jobs Report Keeps Fed on Track
859,Senate Confirms Powell to Second Term Leading Fed
860,Opinion: Rescue From Recession Won’t Be So Easy This Time
861,Fed’s Williams Sees Another Large Rate Rise in July as Possible
862,Jobs Report to Keep Fed on Aggressive Tightening Path
863,Flat Yield Curve Tied to Expectations of Front-Loaded Fed Rate Increases
864,"June Jobs Report Gives Fed License to Keep Raising Rates, Analysts Say"
865,"FedEx Warning, Economic Worries Drag U.S. Stocks Lower"
866,Why Recession Rather Than Inflation May Be Fed’s Preference
867,Analysis: Why the Fed Is Unlikely to Start Raising Rates With a Half-Point Increase
868,Fed's Bullard: Four Interest Rate Rises in 2022 Now Appear Likely
869,FedEx Warns of Shipping Delays as Omicron Hurts Staffing
870,Boston Fed Reports on Technical Work Around Digital Dollar
871,Stocks Fall After FedEx Warning
872,"Next Time, the Fed Might Give No Quarter"
873,"Inflation Eased Slightly in April, According to Fed’s Preferred Measure"
874,Fed Officials Lay Out Case for Further Rate Rises
875,Why the Fed Doesn’t Want You to Get Too Used to High Inflation
876,Fed Nominee Has Pressed to Reverse Trump-Era Banking Policies
877,Fed’s Mester Says More Rate Rises are Needed Amid Inflation Surge
878,"Opinion: What Jerome Powell Couldn’t Say in His Speech, and Doesn’t Know"
879,What the Fed's Interest-Rate Hike Means for Your Finances
880,FedEx Benefits From Higher Prices as Package Volumes Slip
881,How Do You Feel About Inflation? The Answer Will Help Determine Its Longevity
882,Senate Confirms Powell to Second Term Leading Fed
883,Powell Nomination for Second Fed Term Draws Bipartisan Support
884,Fed’s Mester Says More Rate Rises are Needed Amid Inflation Surge
885,"Opinion: What Jerome Powell Couldn’t Say in His Speech, and Doesn’t Know"
886,What the Fed's Interest-Rate Hike Means for Your Finances
887,FedEx Benefits From Higher Prices as Package Volumes Slip
888,SF Fed Paper: Job Market Has More Room to Improve
889,How Do You Feel About Inflation? The Answer Will Help Determine Its Longevity
890,Senate Confirms Powell to Second Term Leading Fed
891,Fed Lifts Rates by 0.75 Point Again
892,Powell Flags Risks of New Digital Financial Products
893,Stocks’ Pivot Spurs Investors to Shore Up Defenses
894,Derby’s Take: Cleveland Fed Finds Some Data Understate Inflation Trend
